{
  "contract_version": "pcb-aoi-inspection-preprocessing/1.0",
  "preprocessing_id": "11111111-1111-4111-8111-111111111111",
  "inspection_id": "22222222-2222-4222-8222-222222222222",
  "validation_id": "33333333-3333-4333-8333-333333333333",
  "policy_id": "synthetic-paired-rgb-height",
  "policy_version": "1.0",
  "implementation_id": "future-synthetic-mock-preprocessor",
  "implementation_version": "0.0-example",
  "outcome": "PREPROCESSING_SUCCEEDED",
  "started_at": "2026-07-17T12:00:00Z",
  "completed_at": "2026-07-17T12:00:00.010000Z",
  "synthetic_input": true,
  "mock_implementation": true,
  "production_approved": false,
  "rgb_input": {"artifact_type": "RGB_RAW", "sha256": "aaaaaaaaaaaaaaaaaaaaaaaaaaaaaaaaaaaaaaaaaaaaaaaaaaaaaaaaaaaaaaaa", "byte_size": 668, "detected_format": "PNG", "width": 16, "height": 12, "channels": 3, "bit_depth": 8, "storage_data_type": "uint8"},
  "height_input": {"artifact_type": "HEIGHT_RAW", "sha256": "bbbbbbbbbbbbbbbbbbbbbbbbbbbbbbbbbbbbbbbbbbbbbbbbbbbbbbbbbbbbbbbb", "byte_size": 542, "detected_format": "TIFF", "width": 16, "height": 12, "channels": 1, "bit_depth": 16, "storage_data_type": "uint16"},
  "rgb_output": {
    "shape": [3, 12, 16], "layout": "CHW", "data_type": "float32", "channel_count": 3, "width": 16, "height": 12,
    "byte_order": "NATIVE", "contiguous": true, "finite_values_verified": true, "source_artifact_sha256": "aaaaaaaaaaaaaaaaaaaaaaaaaaaaaaaaaaaaaaaaaaaaaaaaaaaaaaaaaaaaaaaa",
    "normalization_mode": "UNIT_RANGE", "roi": {"mode": "FULL_FRAME", "x": 0, "y": 0, "width": 16, "height": 12},
    "safe_statistics": {"minimum": 0.047, "maximum": 0.91, "mean": 0.31, "standard_deviation": 0.19, "finite_value_count": 576, "nonfinite_value_count": 0}
  },
  "height_output": {
    "shape": [1, 12, 16], "layout": "CHW", "data_type": "float32", "channel_count": 1, "width": 16, "height": 12,
    "byte_order": "NATIVE", "contiguous": true, "finite_values_verified": true, "source_artifact_sha256": "bbbbbbbbbbbbbbbbbbbbbbbbbbbbbbbbbbbbbbbbbbbbbbbbbbbbbbbbbbbbbbbb",
    "scaling_mode": "NONE", "invalid_value_handling": "REJECT", "physical_unit": null, "physical_scale_applied": false,
    "roi": {"mode": "FULL_FRAME", "x": 0, "y": 0, "width": 16, "height": 12},
    "safe_statistics": {"minimum": 1000.0, "maximum": 1320.0, "mean": 1080.0, "standard_deviation": 95.0, "finite_value_count": 192, "nonfinite_value_count": 0}
  },
  "registration": {"registration_mode": "SYNTHETIC_IDENTITY_ONLY", "registration_status": "SYNTHETIC_IDENTITY", "transform_applied": false, "transform_reference": null, "synthetic_identity": true, "output_coordinate_reference": "SHARED_SYNTHETIC", "registration_warning": "Synthetic identity only; equal dimensions do not prove physical registration."},
  "findings": [{"code": "SYNTHETIC_IDENTITY_REGISTRATION_USED", "severity": "WARNING", "category": "REGISTRATION", "message": "Synthetic identity registration was used; this is not physical registration evidence.", "blocking": false, "branch": "REGISTRATION"}],
  "summary": {"total_findings": 1, "blocking_findings": 0, "warnings": 1, "errors": 0}
}
